{
  "schemaVersion": 1,
  "timestampUtc": "2026-05-13T14:35:00Z",
  "runId": "11111111-1111-4111-8111-111111111111",
  "mvpStage": "mvp_0a",
  "scenario": "foreground",
  "deliveryTestMode": "two_account_canonical",
  "app": {"name": "android-imap-diagnostics", "version": "0.0.1", "buildType": "debug", "buildNumber": "1"},
  "device": {"manufacturer": "Example", "model": "ExamplePhone", "androidVersion": "15", "sdk": 35},
  "network": {
    "type": "mobile",
    "manualMode": "whitelist_restricted",
    "operatorManual": "mts",
    "carrierNameBestEffort": null,
    "mccMncBestEffort": null,
    "region": "example-region",
    "batteryOptimizationIgnored": false,
    "foregroundState": "foreground",
    "vpnActiveBestEffort": false,
    "vpnValidityWarningShown": false
  },
  "provider": {
    "name": "mailru",
    "senderEmailDomain": "example.test",
    "receiverEmailDomain": "example.test",
    "maskedSenderEmail": "***@example.test",
    "maskedReceiverEmail": "***@example.test",
    "imap": {"host": "imap.mail.ru", "port": 993, "security": "tls"},
    "smtp": {"host": "smtp.mail.ru", "port": 465, "security": "tls"},
    "debugOverrideUsed": false
  },
  "timeoutPolicy": {"dnsResolveMs": 5000, "tcpConnectMs": 10000, "tlsHandshakeMs": 15000, "imapGreetingMs": 10000, "imapLoginMs": 20000, "imapSelectMs": 15000, "imapIdleEnterExitMs": 20000, "smtpGreetingMs": 10000, "smtpAuthMs": 20000, "smtpSendAcceptedMs": 30000, "receiveCorrelationMs": 120000, "receivePollingIntervalMs": 5000, "idleObserveWindowMs": 60000, "modifiedFromDefault": false},
  "checks": [{"name": "receive_by_message_id", "protocol": "imap", "status": "ok", "latencyMs": 5300}],
  "messageCorrelation": {"messageId": "<diag-redacted@example.invalid>", "sendAccepted": true, "sendLatencyMs": 0, "received": true, "receiveLatencyMs": 5300, "folder": "INBOX", "spamOrJunk": false, "pollAttempts": 2, "finalStatus": "received"},
  "result": "transport_pass",
  "errorSummary": null,
  "fieldValidity": {"validForWhitelistConclusion": true, "invalidationReasons": []},
  "notes": "synthetic sample"
}
